CREATE TABLE Product (
  2      Product_ID NUMBER PRIMARY KEY,
  3      Product_Name VARCHAR2(100) NOT NULL,
  4      Category_ID NUMBER,
  5      Price NUMBER(10,2) CHECK (Price > 0),
  6      Stock NUMBER CHECK (Stock >= 0),
  7      Material VARCHAR2(50),
  8      Color VARCHAR2(30),
  9      FOREIGN KEY (Category_ID)
 10      REFERENCES Category(Category_ID)
 11  );

Table created.

SQL> INSERT INTO Product VALUES
  2  (101, 'Luxury Sofa', 1, 35000, 10, 'Wood', 'Brown');

1 row created.

SQL> 
SQL> INSERT INTO Product VALUES
  2  (102, 'Modern Sofa', 1, 28000, 15, 'Fabric', 'Grey');

1 row created.

SQL> 
SQL> INSERT INTO Product VALUES
  2  (103, 'King Size Bed', 2, 45000, 8, 'Wood', 'Walnut');

1 row created.

SQL> 
SQL> INSERT INTO Product VALUES
  2  (104, 'Queen Size Bed', 2, 38000, 12, 'Wood', 'White');

1 row created.

SQL> 
SQL> INSERT INTO Product VALUES
  2  (105, 'Office Chair', 3, 8500, 25, 'Plastic', 'Black');

1 row created.

SQL> 
SQL> INSERT INTO Product VALUES
  2  (106, 'Dining Chair', 3, 5000, 30, 'Wood', 'Brown');

1 row created.

SQL> 
SQL> INSERT INTO Product VALUES
  2  (107, 'Dining Table', 4, 22000, 10, 'Wood', 'Natural');

1 row created.

SQL> 
SQL> INSERT INTO Product VALUES
  2  (108, 'Study Table', 4, 12000, 18, 'Wood', 'White');

1 row created.

SQL> 
SQL> INSERT INTO Product VALUES
  2  (109, 'Wooden Cupboard', 5, 30000, 7, 'Wood', 'Brown');

1 row created.

SQL> 
SQL> INSERT INTO Product VALUES
  2  (110, 'Storage Cabinet', 5, 18000, 14, 'Metal', 'Black');

1 row created.

SQL> SELECT * FROM Product;

PRODUCT_ID
----------
PRODUCT_NAME
--------------------------------------------------------------------------------
CATEGORY_ID      PRICE      STOCK
----------- ---------- ----------
MATERIAL
--------------------------------------------------
COLOR
------------------------------
       101
Luxury Sofa
          1      35000         10

PRODUCT_ID
----------
PRODUCT_NAME
--------------------------------------------------------------------------------
CATEGORY_ID      PRICE      STOCK
----------- ---------- ----------
MATERIAL
--------------------------------------------------
COLOR
------------------------------
Wood
Brown


PRODUCT_ID
----------
PRODUCT_NAME
--------------------------------------------------------------------------------
CATEGORY_ID      PRICE      STOCK
----------- ---------- ----------
MATERIAL
--------------------------------------------------
COLOR
------------------------------
       102
Modern Sofa
          1      28000         15

PRODUCT_ID
----------
PRODUCT_NAME
--------------------------------------------------------------------------------
CATEGORY_ID      PRICE      STOCK
----------- ---------- ----------
MATERIAL
--------------------------------------------------
COLOR
------------------------------
Fabric
Grey


PRODUCT_ID
----------
PRODUCT_NAME
--------------------------------------------------------------------------------
CATEGORY_ID      PRICE      STOCK
----------- ---------- ----------
MATERIAL
--------------------------------------------------
COLOR
------------------------------
       103
King Size Bed
          2      45000          8

PRODUCT_ID
----------
PRODUCT_NAME
--------------------------------------------------------------------------------
CATEGORY_ID      PRICE      STOCK
----------- ---------- ----------
MATERIAL
--------------------------------------------------
COLOR
------------------------------
Wood
Walnut


PRODUCT_ID
----------
PRODUCT_NAME
--------------------------------------------------------------------------------
CATEGORY_ID      PRICE      STOCK
----------- ---------- ----------
MATERIAL
--------------------------------------------------
COLOR
------------------------------
       104
Queen Size Bed
          2      38000         12

PRODUCT_ID
----------
PRODUCT_NAME
--------------------------------------------------------------------------------
CATEGORY_ID      PRICE      STOCK
----------- ---------- ----------
MATERIAL
--------------------------------------------------
COLOR
------------------------------
Wood
White


PRODUCT_ID
----------
PRODUCT_NAME
--------------------------------------------------------------------------------
CATEGORY_ID      PRICE      STOCK
----------- ---------- ----------
MATERIAL
--------------------------------------------------
COLOR
------------------------------
       105
Office Chair
          3       8500         25

PRODUCT_ID
----------
PRODUCT_NAME
--------------------------------------------------------------------------------
CATEGORY_ID      PRICE      STOCK
----------- ---------- ----------
MATERIAL
--------------------------------------------------
COLOR
------------------------------
Plastic
Black


PRODUCT_ID
----------
PRODUCT_NAME
--------------------------------------------------------------------------------
CATEGORY_ID      PRICE      STOCK
----------- ---------- ----------
MATERIAL
--------------------------------------------------
COLOR
------------------------------
       106
Dining Chair
          3       5000         30

PRODUCT_ID
----------
PRODUCT_NAME
--------------------------------------------------------------------------------
CATEGORY_ID      PRICE      STOCK
----------- ---------- ----------
MATERIAL
--------------------------------------------------
COLOR
------------------------------
Wood
Brown


PRODUCT_ID
----------
PRODUCT_NAME
--------------------------------------------------------------------------------
CATEGORY_ID      PRICE      STOCK
----------- ---------- ----------
MATERIAL
--------------------------------------------------
COLOR
------------------------------
       107
Dining Table
          4      22000         10

PRODUCT_ID
----------
PRODUCT_NAME
--------------------------------------------------------------------------------
CATEGORY_ID      PRICE      STOCK
----------- ---------- ----------
MATERIAL
--------------------------------------------------
COLOR
------------------------------
Wood
Natural


PRODUCT_ID
----------
PRODUCT_NAME
--------------------------------------------------------------------------------
CATEGORY_ID      PRICE      STOCK
----------- ---------- ----------
MATERIAL
--------------------------------------------------
COLOR
------------------------------
       108
Study Table
          4      12000         18

PRODUCT_ID
----------
PRODUCT_NAME
--------------------------------------------------------------------------------
CATEGORY_ID      PRICE      STOCK
----------- ---------- ----------
MATERIAL
--------------------------------------------------
COLOR
------------------------------
Wood
White


PRODUCT_ID
----------
PRODUCT_NAME
--------------------------------------------------------------------------------
CATEGORY_ID      PRICE      STOCK
----------- ---------- ----------
MATERIAL
--------------------------------------------------
COLOR
------------------------------
       109
Wooden Cupboard
          5      30000          7

PRODUCT_ID
----------
PRODUCT_NAME
--------------------------------------------------------------------------------
CATEGORY_ID      PRICE      STOCK
----------- ---------- ----------
MATERIAL
--------------------------------------------------
COLOR
------------------------------
Wood
Brown


PRODUCT_ID
----------
PRODUCT_NAME
--------------------------------------------------------------------------------
CATEGORY_ID      PRICE      STOCK
----------- ---------- ----------
MATERIAL
--------------------------------------------------
COLOR
------------------------------
       110
Storage Cabinet
          5      18000         14

PRODUCT_ID
----------
PRODUCT_NAME
--------------------------------------------------------------------------------
CATEGORY_ID      PRICE      STOCK
----------- ---------- ----------
MATERIAL
--------------------------------------------------
COLOR
------------------------------
Metal
Black


10 rows selected.

UPDATE Product
  2  SET Price = 37000
  3  WHERE Product_ID = 101;

1 row updated.

SQL> UPDATE Product
  2  SET Stock = 20
  3  WHERE Product_ID = 105;

1 row updated.

SQL> UPDATE Product
  2  SET Color = 'Blue'
  3  WHERE Product_ID = 108;

1 row updated.

SQL> SELECT * FROM Product;

PRODUCT_ID
----------
PRODUCT_NAME
--------------------------------------------------------------------------------
CATEGORY_ID      PRICE      STOCK
----------- ---------- ----------
MATERIAL
--------------------------------------------------
COLOR
------------------------------
       101
Luxury Sofa
          1      37000         10

PRODUCT_ID
----------
PRODUCT_NAME
--------------------------------------------------------------------------------
CATEGORY_ID      PRICE      STOCK
----------- ---------- ----------
MATERIAL
--------------------------------------------------
COLOR
------------------------------
Wood
Brown


PRODUCT_ID
----------
PRODUCT_NAME
--------------------------------------------------------------------------------
CATEGORY_ID      PRICE      STOCK
----------- ---------- ----------
MATERIAL
--------------------------------------------------
COLOR
------------------------------
       102
Modern Sofa
          1      28000         15

PRODUCT_ID
----------
PRODUCT_NAME
--------------------------------------------------------------------------------
CATEGORY_ID      PRICE      STOCK
----------- ---------- ----------
MATERIAL
--------------------------------------------------
COLOR
------------------------------
Fabric
Grey


PRODUCT_ID
----------
PRODUCT_NAME
--------------------------------------------------------------------------------
CATEGORY_ID      PRICE      STOCK
----------- ---------- ----------
MATERIAL
--------------------------------------------------
COLOR
------------------------------
       103
King Size Bed
          2      45000          8

PRODUCT_ID
----------
PRODUCT_NAME
--------------------------------------------------------------------------------
CATEGORY_ID      PRICE      STOCK
----------- ---------- ----------
MATERIAL
--------------------------------------------------
COLOR
------------------------------
Wood
Walnut


PRODUCT_ID
----------
PRODUCT_NAME
--------------------------------------------------------------------------------
CATEGORY_ID      PRICE      STOCK
----------- ---------- ----------
MATERIAL
--------------------------------------------------
COLOR
------------------------------
       104
Queen Size Bed
          2      38000         12

PRODUCT_ID
----------
PRODUCT_NAME
--------------------------------------------------------------------------------
CATEGORY_ID      PRICE      STOCK
----------- ---------- ----------
MATERIAL
--------------------------------------------------
COLOR
------------------------------
Wood
White


PRODUCT_ID
----------
PRODUCT_NAME
--------------------------------------------------------------------------------
CATEGORY_ID      PRICE      STOCK
----------- ---------- ----------
MATERIAL
--------------------------------------------------
COLOR
------------------------------
       105
Office Chair
          3       8500         20

PRODUCT_ID
----------
PRODUCT_NAME
--------------------------------------------------------------------------------
CATEGORY_ID      PRICE      STOCK
----------- ---------- ----------
MATERIAL
--------------------------------------------------
COLOR
------------------------------
Plastic
Black


PRODUCT_ID
----------
PRODUCT_NAME
--------------------------------------------------------------------------------
CATEGORY_ID      PRICE      STOCK
----------- ---------- ----------
MATERIAL
--------------------------------------------------
COLOR
------------------------------
       106
Dining Chair
          3       5000         30

PRODUCT_ID
----------
PRODUCT_NAME
--------------------------------------------------------------------------------
CATEGORY_ID      PRICE      STOCK
----------- ---------- ----------
MATERIAL
--------------------------------------------------
COLOR
------------------------------
Wood
Brown


PRODUCT_ID
----------
PRODUCT_NAME
--------------------------------------------------------------------------------
CATEGORY_ID      PRICE      STOCK
----------- ---------- ----------
MATERIAL
--------------------------------------------------
COLOR
------------------------------
       107
Dining Table
          4      22000         10

PRODUCT_ID
----------
PRODUCT_NAME
--------------------------------------------------------------------------------
CATEGORY_ID      PRICE      STOCK
----------- ---------- ----------
MATERIAL
--------------------------------------------------
COLOR
------------------------------
Wood
Natural


PRODUCT_ID
----------
PRODUCT_NAME
--------------------------------------------------------------------------------
CATEGORY_ID      PRICE      STOCK
----------- ---------- ----------
MATERIAL
--------------------------------------------------
COLOR
------------------------------
       108
Study Table
          4      12000         18

PRODUCT_ID
----------
PRODUCT_NAME
--------------------------------------------------------------------------------
CATEGORY_ID      PRICE      STOCK
----------- ---------- ----------
MATERIAL
--------------------------------------------------
COLOR
------------------------------
Wood
Blue


PRODUCT_ID
----------
PRODUCT_NAME
--------------------------------------------------------------------------------
CATEGORY_ID      PRICE      STOCK
----------- ---------- ----------
MATERIAL
--------------------------------------------------
COLOR
------------------------------
       109
Wooden Cupboard
          5      30000          7

PRODUCT_ID
----------
PRODUCT_NAME
--------------------------------------------------------------------------------
CATEGORY_ID      PRICE      STOCK
----------- ---------- ----------
MATERIAL
--------------------------------------------------
COLOR
------------------------------
Wood
Brown


PRODUCT_ID
----------
PRODUCT_NAME
--------------------------------------------------------------------------------
CATEGORY_ID      PRICE      STOCK
----------- ---------- ----------
MATERIAL
--------------------------------------------------
COLOR
------------------------------
       110
Storage Cabinet
          5      18000         14

PRODUCT_ID
----------
PRODUCT_NAME
--------------------------------------------------------------------------------
CATEGORY_ID      PRICE      STOCK
----------- ---------- ----------
MATERIAL
--------------------------------------------------
COLOR
------------------------------
Metal
Black


10 rows selected.

DELETE FROM Product
  2  WHERE Product_ID = 109;

1 row deleted.

SQL> DELETE FROM Product
  2  WHERE Product_ID = 110;

1 row deleted.

SQL> SELECT * FROM Product;

PRODUCT_ID
----------
PRODUCT_NAME
--------------------------------------------------------------------------------
CATEGORY_ID      PRICE      STOCK
----------- ---------- ----------
MATERIAL
--------------------------------------------------
COLOR
------------------------------
       101
Luxury Sofa
          1      37000         10

PRODUCT_ID
----------
PRODUCT_NAME
--------------------------------------------------------------------------------
CATEGORY_ID      PRICE      STOCK
----------- ---------- ----------
MATERIAL
--------------------------------------------------
COLOR
------------------------------
Wood
Brown


PRODUCT_ID
----------
PRODUCT_NAME
--------------------------------------------------------------------------------
CATEGORY_ID      PRICE      STOCK
----------- ---------- ----------
MATERIAL
--------------------------------------------------
COLOR
------------------------------
       102
Modern Sofa
          1      28000         15

PRODUCT_ID
----------
PRODUCT_NAME
--------------------------------------------------------------------------------
CATEGORY_ID      PRICE      STOCK
----------- ---------- ----------
MATERIAL
--------------------------------------------------
COLOR
------------------------------
Fabric
Grey


PRODUCT_ID
----------
PRODUCT_NAME
--------------------------------------------------------------------------------
CATEGORY_ID      PRICE      STOCK
----------- ---------- ----------
MATERIAL
--------------------------------------------------
COLOR
------------------------------
       103
King Size Bed
          2      45000          8

PRODUCT_ID
----------
PRODUCT_NAME
--------------------------------------------------------------------------------
CATEGORY_ID      PRICE      STOCK
----------- ---------- ----------
MATERIAL
--------------------------------------------------
COLOR
------------------------------
Wood
Walnut


PRODUCT_ID
----------
PRODUCT_NAME
--------------------------------------------------------------------------------
CATEGORY_ID      PRICE      STOCK
----------- ---------- ----------
MATERIAL
--------------------------------------------------
COLOR
------------------------------
       104
Queen Size Bed
          2      38000         12

PRODUCT_ID
----------
PRODUCT_NAME
--------------------------------------------------------------------------------
CATEGORY_ID      PRICE      STOCK
----------- ---------- ----------
MATERIAL
--------------------------------------------------
COLOR
------------------------------
Wood
White


PRODUCT_ID
----------
PRODUCT_NAME
--------------------------------------------------------------------------------
CATEGORY_ID      PRICE      STOCK
----------- ---------- ----------
MATERIAL
--------------------------------------------------
COLOR
------------------------------
       105
Office Chair
          3       8500         20

PRODUCT_ID
----------
PRODUCT_NAME
--------------------------------------------------------------------------------
CATEGORY_ID      PRICE      STOCK
----------- ---------- ----------
MATERIAL
--------------------------------------------------
COLOR
------------------------------
Plastic
Black


PRODUCT_ID
----------
PRODUCT_NAME
--------------------------------------------------------------------------------
CATEGORY_ID      PRICE      STOCK
----------- ---------- ----------
MATERIAL
--------------------------------------------------
COLOR
------------------------------
       106
Dining Chair
          3       5000         30

PRODUCT_ID
----------
PRODUCT_NAME
--------------------------------------------------------------------------------
CATEGORY_ID      PRICE      STOCK
----------- ---------- ----------
MATERIAL
--------------------------------------------------
COLOR
------------------------------
Wood
Brown


PRODUCT_ID
----------
PRODUCT_NAME
--------------------------------------------------------------------------------
CATEGORY_ID      PRICE      STOCK
----------- ---------- ----------
MATERIAL
--------------------------------------------------
COLOR
------------------------------
       107
Dining Table
          4      22000         10

PRODUCT_ID
----------
PRODUCT_NAME
--------------------------------------------------------------------------------
CATEGORY_ID      PRICE      STOCK
----------- ---------- ----------
MATERIAL
--------------------------------------------------
COLOR
------------------------------
Wood
Natural


PRODUCT_ID
----------
PRODUCT_NAME
--------------------------------------------------------------------------------
CATEGORY_ID      PRICE      STOCK
----------- ---------- ----------
MATERIAL
--------------------------------------------------
COLOR
------------------------------
       108
Study Table
          4      12000         18

PRODUCT_ID
----------
PRODUCT_NAME
--------------------------------------------------------------------------------
CATEGORY_ID      PRICE      STOCK
----------- ---------- ----------
MATERIAL
--------------------------------------------------
COLOR
------------------------------
Wood
Blue


8 rows selected.

 SELECT
  2      Category.Category_Name,
  3      Product.Product_Name,
  4      Product.Price,
  5      Product.Stock
  6  FROM Category
  7  JOIN Product
  8  ON Category.Category_ID = Product.Category_ID
  9  ORDER BY Category.Category_Name;

CATEGORY_NAME
--------------------------------------------------
PRODUCT_NAME
--------------------------------------------------------------------------------
     PRICE      STOCK
---------- ----------
Bed
Queen Size Bed
     38000         12

Bed
King Size Bed
     45000          8

CATEGORY_NAME
--------------------------------------------------
PRODUCT_NAME
--------------------------------------------------------------------------------
     PRICE      STOCK
---------- ----------

Chair
Office Chair
      8500         20

Chair
Dining Chair

CATEGORY_NAME
--------------------------------------------------
PRODUCT_NAME
--------------------------------------------------------------------------------
     PRICE      STOCK
---------- ----------
      5000         30

Sofa
Modern Sofa
     28000         15

Sofa

CATEGORY_NAME
--------------------------------------------------
PRODUCT_NAME
--------------------------------------------------------------------------------
     PRICE      STOCK
---------- ----------
Luxury Sofa
     37000         10

Table
Dining Table
     22000         10


CATEGORY_NAME
--------------------------------------------------
PRODUCT_NAME
--------------------------------------------------------------------------------
     PRICE      STOCK
---------- ----------
Table
Study Table
     12000         18


8 rows selected.

SELECT
  2      Category.Category_Name,
  3      COUNT(Product.Product_ID) AS Total_Products
  4  FROM Category
  5  LEFT JOIN Product
  6  ON Category.Category_ID = Product.Category_ID
  7  GROUP BY Category.Category_Name
  8  ORDER BY Category.Category_Name;

CATEGORY_NAME                                      TOTAL_PRODUCTS
-------------------------------------------------- --------------
Bed                                                             2
Chair                                                           2
Sofa                                                            2
Storage                                                         0
Table                                                           2

COMMIT;

Commit complete.